{
	"$schema": "../../../schemas/target-config.schema.json",
	"name": "codex",
	"displayName": "Codex Desktop",
	"configDir": "~/.codex",
	"configDirEnv": "CODEX_HOME",
	"configFile": "config.toml",
	"instructionsFile": "AGENTS.md",
	"settingsSync": {
		"source": "packages/targets/codex/config.toml",
		"format": "toml",
		"keys": [
			"model",
			"model_provider",
			"model_reasoning_effort",
			"plan_mode_reasoning_effort",
			"model_reasoning_summary",
			"model_verbosity",
			"model_context_window",
			"model_auto_compact_token_limit",
			"review_model",
			"approval_policy",
			"approvals_reviewer",
			"default_permissions",
			"personality",
			"sandbox_mode",
			"sandbox_workspace_write.network_access",
			"suppress_unstable_features_warning",
			"agents.max_threads",
			"agents.max_depth",
			"agents.default_subagent_model",
			"agents.default_subagent_reasoning_effort",
			"memories.disable_on_external_context",
			"memories.generate_memories",
			"memories.use_memories",
			"tui.status_line",
			"notice.fast_default_opt_out",
			"desktop.avatar-overlay-pet-visible"
		],
		"removeKeys": [
			"model_catalog_json"
		],
		"computedFeatures": {
			"table": "packages/targets/codex/features.json",
			"prefix": "features"
		},
		"localSource": "packages/targets/codex/config.local.toml",
		"localKeys": [
			"sandbox_workspace_write.writable_roots"
		],
		"extrasSource": "packages/extras/_active/targets/codex/config.toml",
		"extrasKeys": [
			"desktop.dictationDictionary",
			"model_providers.cursorapi.name",
			"model_providers.cursorapi.base_url",
			"model_providers.cursorapi.wire_api",
			"model_providers.cursorapi.auth.command",
			"model_providers.cursorapi.auth.args",
			"model_providers.cursorapi.auth.refresh_interval_ms"
		]
	},
	"distribute": {
		"AGENTS.md": {
			"source": "packages/targets/codex/AGENTS.md",
			"expandIncludes": true
		},
		"commands.md": {
			"source": "packages/core/commands.md"
		},
		"skills/": {
			"source": "packages/targets/codex/skills/"
		},
		"agents/": {
			"source": "packages/targets/codex/agents/"
		},
		"keybindings.json": {
			"source": "packages/targets/codex/keybindings.json"
		},
		"review.config.toml": {
			"source": "packages/targets/codex/profiles/review.config.toml"
		},
		"review-high.config.toml": {
			"source": "packages/targets/codex/profiles/review-high.config.toml"
		},
		"rules/": {
			"source": [
				"packages/core/rules/"
			]
		}
	},
	"obsoleteFiles": [
		"hooks.json",
		"hooks/block-dangerous-in-bash.sh",
		"hooks/block-edit-on-main.sh",
		"hooks/block-grep-in-bash.sh",
		"hooks/block-pr-without-codex-review.sh",
		"hooks/block-repeated-codex-review.sh",
		"hooks/check-plan-model.sh",
		"hooks/codex-review-bypass.sh",
		"hooks/codex-review-reminder.sh",
		"hooks/codex-review-reset.sh",
		"hooks/enforce-gwm-for-worktree.sh",
		"hooks/fix_gfm_tables.py",
		"hooks/log-compaction.sh",
		"hooks/rtk-rewrite.sh",
		"hooks/scan-new-skills.sh",
		"hooks/set-codex-review-flag.sh",
		"hooks/validate-prompt.sh",
		"hooks/verify-before-commit.sh",
		"hooks/verify-before-push.sh",
		"hooks/lib/denial-log.sh",
		"hooks/lib/review-gate.sh",
		"rules/coding-policy.md",
		"rules/correction-lessons.md",
		"rules/ai-antipattern-prevention.md",
		"rules/security-review-sinks.md",
		"rules/git-safety.md",
		"rules/worktree-directory-change.md",
		"knowledge-notes/NOTICE.txt",
		"knowledge-notes/component-bestiary-reference.md",
		"knowledge-notes/component-governance.md",
		"knowledge-notes/design-to-code-contract.md",
		"knowledge-notes/output-discipline.md",
		"knowledge-notes/token-architecture.md"
	],
	"notes": [
		"共通skillsはshared-agents targetから ~/.agents/skillsへ1回だけ配布し、Codex targetでは複製しない",
		"bm25-code-search と codex-reset-credits は Codex 専用の target skill として ~/.codex/skills に配布する。shared-agents target には含めない",
		"rules/ はCodex globalへコピーし、workflow/hook/policyはharunon-core pluginに閉じ込める",
		"AGENTS.md は Codex 専用の薄い常駐テンプレート（packages/targets/codex/AGENTS.md が SSOT）。共通ルール全文を常時ロードさせず、必要時に rules/ · skills/ · commands.md を読ませるルーティングのみを常駐させる。core/CLAUDE.md（Claude の source）とは分離",
		"AGENTS.md が参照する RTK.md / commands.md もコピー配布（dangling 参照防止）",
		"Core Workflow adapterはpackages/runtimes/codex/harunon-coreからCodex pluginとして配布し、公開操作の承認はCodex native permissionsに委ねる。plugin移行前のliveな ~/.codex/hooks.json + hooks/ は obsoleteFiles として退役させる",
		"config.toml はsettingsSyncで意図的なユーザー設定キー（model/approval/personality/features/memories/tui.status_line 等）を同期。writable_rootsはマシン固有のためlocal管理。会社・契約固有の値（dictationDictionary の固有名 / cursorapi provider）は extrasSource/extrasKeys で extras submodule から同期し、harness 本体に固有名を置かない。marketplaces/plugins/projects/hooks.state/desktop テーマ/notify/service_tier/tui.model_availability_nux はアプリ管理状態のため対象外（desktop.avatar-overlay-pet-visible だけは例外で同期する。Codex Desktop の Pet を消す hidden 設定で UI から変更できず、アプリが config.toml を書き戻すため SSOT で保持しないと再出現する）。harunon-core pluginはbuild-codex-plugin.pyでSSOTから組み立てる",
		"harunon-core plugin の live 配備は bootstrap の対象外（Codex がアプリ管理する plugins/cache と config.toml の [plugins.*] に書き込むと本体の管理と衝突する）。組み立て済みを codex plugin add で入れる運用で、未インストール・未更新の検知は harness-doctor.sh が担う（そこに具体的なコマンドが出る）。CI は build できることしか見ないため、この検知が無いと配備漏れが緑のまま残る",
		"keybindings.json（dictation キーバインド）と review*.config.toml（レビュー用モデルプロファイル）は targets/codex 配下で SSOT 化。review-high.config.toml は既存呼び出し互換の Sol medium alias として残す。cursor*.config.toml（Cursor 契約時専用プロファイル 3 件）は extras 配下から配布。~/.codex/prompts/opsx-*.md は OpenSpec CLI 生成物のため対象外、~/.codex/skills/ は旧配布の残骸（現行は shared-agents → ~/.agents/skills）のため対象外",
		"agents/ は Codex カスタムサブエージェント（explorer/worker/reviewer）を配布。config.toml の [agents] max_threads / max_depth も settingsSync で同期",
		"model / model_reasoning_effort / plan_mode_reasoning_effort は Codex app 再起動時の medium へのリセットを防ぐため SSOT から push 同期する。CODEX_HOME が設定された管理ランタイムでは configDirEnv を優先して実際の Codex home に配布する。model_catalog_json は管理対象から外し、既存の live 設定は removeKeys で撤去する。"
	],
	"deprecates": [
		"/copy-skills-to-codex → /sync-settings --push codex に統合"
	]
}
