{
	"$schema": "../../../schemas/target-config.schema.json",
	"name": "omp",
	"displayName": "oh-my-pi (omp)",
	"configDir": "~/.omp/agent",
	"configFile": "config.yml",
	"instructionsFile": "AGENTS.md",
	"distribute": {
		"AGENTS.md": {
			"source": "packages/targets/omp/AGENTS.md",
			"expandIncludes": true
		},
		"commands.md": {
			"source": "packages/core/commands.md"
		},
		"extensions/harness-policy.js": {
			"source": "packages/core/pi-extensions/harness-policy.js"
		},
		"extensions/post-edit-checks.js": {
			"source": "packages/core/pi-extensions/post-edit-checks.js"
		},
		"claude-hooks/post-edit-checks.sh": {
			"source": "packages/core/hooks/post-edit-checks.sh"
		},
		"claude-hooks/fix_gfm_tables.py": {
			"source": "packages/core/hooks/fix_gfm_tables.py"
		},
		"extensions/omp-denial-reason.js": {
			"source": "packages/core/omp-extensions/omp-denial-reason.js"
		},
		"hook-runner/": {
			"source": "packages/core/hook-runner/"
		},
		"claude-hooks/block-dangerous-in-bash.sh": {
			"source": "packages/core/hooks/block-dangerous-in-bash.sh"
		},
		"claude-hooks/approve-push.sh": {
			"source": "packages/core/hooks/approve-push.sh"
		},
		"claude-hooks/approve-pr.sh": {
			"source": "packages/core/hooks/approve-pr.sh"
		},
		"claude-hooks/lib/": {
			"source": "packages/core/hooks/lib/",
			"hookLibClosure": true
		},
		"policy/": {
			"source": "packages/core/policy/"
		},
		"workflows/": {
			"source": "packages/core/workflows/"
		},
		"rules/": {
			"source": [
				"packages/core/rules/"
			]
		}
	},
	"settingsSync": {
		"source": "packages/targets/omp/config.yml",
		"format": "yaml",
		"keys": [
			"modelRoles",
			"hideThinkingBlock",
			"tools.approvalMode",
			"plan.defaultOnStartup",
			"display.hideToolActivity",
			"enabledModels",
			"bash.patterns",
			"skills"
		],
		"removeKeys": [
			"permissions"
		],
		"computedGlobs": {
			"table": "packages/core/policy/danger-rules.json",
			"target": "omp",
			"mergeKey": "bash.patterns",
			"mergeShape": "orderedPatterns"
		},
		"computedSkillIgnores": {
			"target": "omp",
			"mergeKey": "skills.ignoredSkills"
		}
	},
	"obsoleteFiles": [
		"rules/worktree-directory-change.md",
		"skills/upgrade/SKILL.md",
		"skills/codex-reset-credits/SKILL.md",
		"skills/codex-reset-credits/scripts/check-reset-credits.mjs"
	],
	"notes": [
		"skills は omp 自身の configDir に配布しない。omp は ~/.agents/skills（skills.enableAgentsUser、既定 on）を読み、shared-agents target が全 skill を配布する（skill pack 廃止: 2026-08-19）ため自前配布は二重になる。旧 include で配っていた upgrade / codex-reset-credits は obsoleteFiles で掃除する",
		"disabledSkills は packages/core/disabled-skills.json（common + target 別）と extras 側 disabled-skills.json で宣言する。omp では配布除外では隠せない（~/.agents 経由で見えてしまう）ため、settingsSync.computedSkillIgnores が同じ SSOT から skills.ignoredSkills を計算して config.yml に同期する",
		"omp = @oh-my-pi/pi-coding-agent。config は ~/.omp/agent（config.yml が権威、omp が管理）。旧 pi ターゲット（@earendil-works, ~/.pi/agent, settings.json）とは別フォーク・別スキーマ",
		"AGENTS.md は omp 専用の薄い常駐テンプレート（packages/targets/omp/AGENTS.md が SSOT）。共有ブロック（常駐ルール最小・Routing）は packages/core/fragments/agents-md/ を expandIncludes で取り込む",
		"hooks.json / keybindings.yml / model-providers.json は omp が使わない。config.yml の bash.patterns（danger-rules.json 由来の deny / prompt）が危険コマンドの deny を担い、Core Workflow gate は extensions/harness-policy.js が担う。claude-hooks/ に配るのは 2 群: (a) guard = block-dangerous-in-bash.sh とその lib/、approve-push.sh / approve-pr.sh（ユーザーが手で叩く承認スクリプト）。glob deny はメッセージを運べないため extensions/omp-denial-reason.js（adapter）が bash の tool_call ごとに hook-runner/hook-runner.js（runtime 共有の hookRunner）を HARNESS_RUNTIME=omp で走らせ、deny の理由（approve-*.sh / rule の message）を block reason として返す。omp に配線する hook は hook-pipeline.json の runtimes が決める（現状 block-dangerous-in-bash のみ）。hook は隣の ../policy/danger-rules.json を読むので policy/ の配布と同居が前提。(b) L1 = post-edit-checks.sh + fix_gfm_tables.py。extensions/post-edit-checks.js（pi と共有の adapter。omp 18.0.8 の tool_result イベントは pi と同名・同形）→ hook-runner/post-edit.js が write/edit 後の shellcheck / jq / GFM チェックを tool result に追記する（2026-08-30。2026-09-03 に判定本体を hookRunner へ寄せた）",
		"HEADROOM は Anthropic API proxy = Claude 専用のため omp には配布しない",
		"config.yml の管理キー（modelRoles / enabledModels 等）は settingsSync（YAML）で同期する。omp のセットアップウィザードが config.yml を再生成するとドリフトするため --check で監視する",
		"モデル方針は全 role（default/slow/plan/smol/task/commit）を gpt-5.6-luna:max に統一（ADR-010 Amendment 2026-08-20）。thinking block は hideThinkingBlock で表示しない。Terra は採用せず、OpenAI Codex OAuth が使えない場合も別 provider へ自動 fallback しない。契約終了時は明示的な provider 切替手順を実行する",
		"omp の実チャネルは bash.patterns（{match, approval} の順序付き配列。approval は allow|deny|prompt、first-match-wins）。permissions キーは omp が読まない（2026-08-23 実測: omp config get permissions → Unknown setting、バイナリにも読み取りコード無し）。旧 permissions.bash の deny/ask 生成物は完全に inert だったため bash.patterns の computedGlobs（mergeShape: orderedPatterns）に移行し、旧 permissions ブロックは removeKeys で live から撤去する"
	]
}
