{
	"$schema": "../../../schemas/target-config.schema.json",
	"name": "shared-agents",
	"displayName": "Shared Agent Skills",
	"configDir": "~/.agents",
	"configFile": "",
	"instructionsFile": "",
	"distribute": {
		"policy/": {
			"source": "packages/core/policy/"
		},
		"workflows/": {
			"source": "packages/core/workflows/"
		},
		"lessons/": {
			"source": "packages/core/lessons/"
		},
		"skills/": {
			"source": [
				"packages/core/skills/",
				".rulesync/skills/.curated/"
			],
			"transform": "portableFrontmatter"
		}
	},
	"skillsTransform": {
		"keepFrontmatterFields": [
			"name",
			"description",
			"license",
			"compatibility",
			"metadata"
		]
	},
	"obsoleteFiles": [
		"skills/component-audit/SKILL.md",
		"skills/design-to-code-check/SKILL.md",
		"skills/drift-detection/SKILL.md",
		"skills/writing-great-skills/SKILL.md",
		"skills/writing-great-skills/GLOSSARY.md",
		"skills/sentry-fix/SKILL.md",
		"skills/codex-reset-credits/SKILL.md",
		"skills/codex-reset-credits/scripts/check-reset-credits.mjs"
	],
	"notes": [
		"旧名 portable（2026-08-29 に改名。実態が『Claude 以外 4 runtime の共有置き場』なので名前を合わせた）。旧名で書かれた live の ledger は distribution_state.LEDGER_TARGET_ALIASES が読み、次の --push で新名に書き直す。lock ファイル名は configDir 由来（~/..agents.harness-distribution.lock）で影響なし",
		"Codex/OpenCode/pi/ompが共通利用するshared-agents skillの唯一の配布先。runtime固有skillは各runtime packageに置く",
		"skill は core + extras の全件を配布する（skill pack によるキュレーションは 2026-08-19 に廃止。『SSOT にはあるが配布されていない』ズレで skill 不在エラーが頻発したため）。除外は互換性理由のみ: disabled-skills.json（core は common + shared-agents キー、extras は shared-agents キー）が唯一の除外機構。baoyu-design と better-interface は必要なプロジェクトで外部installする",
		"obsoleteFiles: 退役 skill と、全件配布への移行で除外に転じた skill（sentry-fix は旧 pack で配布済み、codex-reset-credits は Codex target edge へ移動）の掃除。ledger は今回配ったものしか記録しないため、ledger 未保有マシンではここに宣言しない限り残り続ける",
		"skills/ の source 配列に .rulesync/skills/.curated/ を追加してあり、外部 skill（rulesync upstream）も core/extras と同じ distribution ledger で管理する（--check で drift 検出、--push --prune で退役分を削除。ADR-011 Update 2026-08-30）。portableFrontmatter transform は curated skill の SKILL.md にも適用される。rulesync 未取得時（.rulesync/skills/.curated/ 不在）は uninitialized submodule と同様に skip（incomplete dest）で、curated skill 抜きの manifest になる"
	]
}
