{
	"$schema": "../../../schemas/target-config.schema.json",
	"name": "opencode",
	"displayName": "OpenCode",
	"configDir": "~/.config/opencode",
	"configFile": "opencode.json",
	"instructionsFile": "AGENTS.md",
	"settingsSync": {
		"source": "packages/targets/opencode/permission-overlay.json",
		"keys": [
			"permission",
			"default_agent",
			"instructions",
			"skills"
		],
		"removeKeys": [
			"env"
		],
		"computedGlobs": {
			"table": "packages/core/policy/danger-rules.json",
			"target": "opencode",
			"mergeKey": "permission.bash",
			"mergeShape": "flat"
		}
	},
	"distribute": {
		"AGENTS.md": {
			"source": "packages/targets/opencode/AGENTS.md",
			"expandIncludes": true
		},
		"commands.md": {
			"source": "packages/core/commands.md"
		},
		"agents/": {
			"source": "packages/targets/opencode/agents/"
		},
		"rules/": {
			"source": [
				"packages/core/rules/"
			]
		},
		"plugins/": {
			"source": "packages/runtimes/opencode/"
		},
		"runtime/harunon-opencode/": {
			"source": "packages/core/opencode-plugins/"
		},
		"runtime/hook-runner/": {
			"source": "packages/core/hook-runner/"
		},
		"runtime/policy/": {
			"source": "packages/core/policy/"
		},
		"runtime/model-providers.json": {
			"source": "packages/core/model-providers.json"
		},
		"runtime/claude-hooks/block-grep-in-bash.sh": {
			"source": "packages/core/hooks/block-grep-in-bash.sh"
		},
		"runtime/claude-hooks/block-dangerous-in-bash.sh": {
			"source": "packages/core/hooks/block-dangerous-in-bash.sh"
		},
		"runtime/claude-hooks/block-secrets-in-commit.sh": {
			"source": "packages/core/hooks/block-secrets-in-commit.sh"
		},
		"runtime/claude-hooks/rtk-rewrite.sh": {
			"source": "packages/core/hooks/rtk-rewrite.sh"
		},
		"runtime/claude-hooks/post-edit-checks.sh": {
			"source": "packages/core/hooks/post-edit-checks.sh"
		},
		"runtime/claude-hooks/fix_gfm_tables.py": {
			"source": "packages/core/hooks/fix_gfm_tables.py"
		},
		"runtime/claude-hooks/lib/": {
			"source": "packages/core/hooks/lib/",
			"hookLibClosure": true
		},
		"runtime/workflows/": {
			"source": "packages/core/workflows/"
		}
	},
	"configManagedResources": {
		"settingsSync": "opencode.json の permission/default_agent/instructions/skills キーは SSOT で同期（permission-overlay.json）。agent modelはauth構成がマシン依存のためローカル管理",
		"skillsPaths": "shared-agents targetの ~/.agents/skills 1本を参照し、runtime targetではskillを複製しない",
		"instructions": "opencode.json の instructions は空（常駐は AGENTS.md のみ）。rules/*.md は on-demand で読む（薄型化）。常駐に戻すルールがあれば個別パスを追加する"
	},
	"disabledPlugins": [],
	"obsoleteFiles": [
		"plugins/README.md",
		"plugins/block-bash-dangerous-git.js",
		"plugins/block-grep-in-bash.js",
		"plugins/enforce-gwm-for-worktree.js",
		"plugins/fix-gfm-tables.js",
		"plugins/model-providers.js",
		"plugins/rtk-rewrite.js",
		"plugins/scan-new-skills.js",
		"plugins/verify-before-commit.js",
		"plugins/verify-before-push.js",
		"rules/worktree-directory-change.md",
		"runtime/harunon-opencode/verify-before-commit.js",
		"runtime/harunon-opencode/verify-before-push.js",
		"policy/danger-rules.json",
		"policy/harnessctl.py",
		"policy/hook-pipeline.json",
		"policy/schema.py",
		"workflows/change.json",
		"workflows/task-state.schema.json",
		"model-providers.json",
		"knowledge-notes/NOTICE.txt",
		"knowledge-notes/component-bestiary-reference.md",
		"knowledge-notes/component-governance.md",
		"knowledge-notes/design-to-code-contract.md",
		"knowledge-notes/output-discipline.md",
		"knowledge-notes/token-architecture.md"
	],
	"notes": [
		"AGENTS.md は OpenCode 専用の薄い常駐テンプレート（packages/targets/opencode/AGENTS.md が SSOT）。共通ルール全文を常時ロードさせず、必要時に rules/ · skills/ · commands.md を読ませるルーティングのみを常駐させる。日本語必須・絶対禁止リスト（main 保護の二重ガード）は安全上そのまま常駐。core/CLAUDE.md（Claude の source）とは分離",
		"instructions は薄型化に伴い rules/*.md の glob をやめ、常駐は AGENTS.md のみ（rules は on-demand で読む）。品質のため常駐に戻したいルールがあれば permission-overlay.json の instructions に個別追加する",
		"rules/ はruntime固有配布、共通skillsはshared-agents targetから ~/.agents/skills に1回だけ配布する",
		"opencode.json の permission/default_agent/instructions/skills は permission-overlay.json で SSOT 化（settingsSync で自動同期）。agent はローカル管理（model がマシンの auth 構成に依存するため SSOT に入れない）",
		"opencode.json の MCP 等は個別保持（マシン依存）",
		"plugins/ はumbrella plugin harunon.js 1本だけを自動ロードし、個別実装はruntime/harunon-opencode/へ配布して決定順で合成する",
		"model-providers.json は LLM プロバイダ定義の SSOT。umbrella plugin内のModelProvidersがconfig hookで注入する（opencode.json手書き定義が優先）。配布は runtime/model-providers.json の 1 本（plugin が import.meta 相対で読む。root 二重配布は 2026-07-27 に廃止）",
		"guard hooks（block-grep / block-dangerous / rtk-rewrite + lib）は runtime/claude-hooks/ へ自己完結配布し、runtime/harunon-opencode/claude-hooks-bridge.js（adapter）が runtime/hook-runner/hook-runner.js（runtime 共有の hookRunner）経由で実行する。どの hook を流すかは runtime/policy/hook-pipeline.json の runtimes が決め、bridge に hook 一覧は無い（fail-closed: required hook が未配布なら bash を deny）。~/.claude/hooks への実行時依存は 2026-07-27 に廃止 — claude target 未配布のマシンで guard が黙って無効化されていた。block-dangerous の $HOOK_DIR/../policy/ は runtime/policy/ に解決される",
		"policy/ の配布は runtime/policy/ の 1 本（harness-policy.js が import.meta 相対で参照）。run-change の harnessctl probe は ~/.agents/policy/（shared-agents 配布）が第 1 候補で当たるため root policy/ は不要（2026-07-27 に廃止）",
		"shared-agents skillは公式5 frontmatter fieldだけへcompileし、runtime固有tool名を本文に残さないvalidatorを通す",
		"agents/ は explorer/worker/reviewer の3 subagent md（Codex の agents/*.toml と同粒度）を ~/.config/opencode/agents/ に配布する（グローバル配置パスは opencode.ai/docs/agents で確認済み）。reviewer は gpt-5.6-sol / medium / 8 steps に固定し、レビュー親からの重複実行を禁止する"
	],
	"differences": {
		"hooks": "Claude Code は shell script (PreToolUse 等)、OpenCode は plugin (tool.execute.before 等)。直接互換なし",
		"agents": "Claude Code は .claude/agents/<name>.md、OpenCode はグローバル ~/.config/opencode/agents/<name>.md（プロジェクトは .opencode/agents/。公式 docs で確認済み 2026-07-11）",
		"configFormat": "Claude Code は settings.json、OpenCode は opencode.json（$schema 付き）"
	},
	"todoInvestigate": [
		"SessionStart 相当の check-plan-model は OpenCode の `session.created` event で警告表示できるか検証"
	]
}
